S. No.,Message_body,Label
822,Camera - You are awarded a SiPix Digital Camera! call 09061221066 fromm landline. Delivery within 28 days.,Spam
823,Thinking of u ;) x,Non-Spam
824,I am in hospital da. . I will return home in evening,Non-Spam
825,Ya very nice. . .be ready on thursday,Non-Spam
826,Many more happy returns of the day. I wish you happy birthday.,Non-Spam
827,"I keep seeing weird shit and bein all ""woah"" then realising it's actually reasonable and I'm all ""oh""",Non-Spam
828,We have pizza if u want,Non-Spam
829,I bought the test yesterday. Its something that lets you know the exact day u ovulate.when will get 2u in about 2 to 3wks. But pls pls dont fret. I know u r worried. Pls relax. Also is there anything in ur past history u need to tell me?,Non-Spam
830,"Nt only for driving even for many reasons she is called BBD..thts it chikku, then hw abt dvg cold..heard tht vinobanagar violence hw is the condition..and hw ru ? Any problem?",Non-Spam
831,"Not for possession, especially not first offense",Non-Spam
832,Oh k:)after that placement there ah?,Non-Spam
833,Buy Space Invaders 4 a chance 2 win orig Arcade Game console. Press 0 for Games Arcade (std WAP charge) See o2.co.uk/games 4 Terms + settings. No purchase,Spam
834,Good Morning my Dear Shijutta........... Have a great &amp; successful day.,Non-Spam
835,Wat time r ü going to xin's hostel?,Non-Spam
836,K:)eng rocking in ashes:),Non-Spam
837,I dont know ask to my brother. Nothing problem some thing that. Just i told .,Non-Spam
838,I've reached already.,Non-Spam
839,I (Career Tel) have added u as a contact on INDYAROCKS.COM to send FREE SMS. To remove from phonebook - sms NO to  &lt;#&gt;,Non-Spam
840,"Had your mobile 10 mths? Update to the latest Camera/Video phones for FREE. KEEP UR SAME NUMBER, Get extra free mins/texts. Text YES for a call",Spam
841,Jason says it's cool if we pick some up from his place in like an hour,Non-Spam
842,"There'll be a minor shindig at my place later tonight, you interested?",Non-Spam
843,"FREE GAME. Get Rayman Golf 4 FREE from the O2 Games Arcade. 1st get UR games settings. Reply POST, then save & activ8. Press 0 key for Arcade. Termsapply",Spam
844,HELLO PEACH! MY CAKE TASTS LUSH!,Non-Spam
845,"I'm home, my love ... If your still awake ... *loving kiss*",Non-Spam
846,"Yup. Anything lor, if u dun wan it's ok...",Non-Spam
847,Forgot to tell ü smth.. Can ü like number the sections so that it's clearer..,Non-Spam
848,"Aiyo... Her lesson so early... I'm still sleepin, haha... Okie, u go home liao den confirm w me lor...",Non-Spam
849,My uncles in Atlanta. Wish you guys a great semester.,Non-Spam
850,"K will do, addie &amp; I are doing some art so I'll be here when you get home",Non-Spam
851,"Hey. What happened? U switch off ur cell d whole day. This isnt good. Now if u do care, give me a call tomorrow.",Non-Spam
852,S:)8 min to go for lunch:),Non-Spam
853,Oops i thk i dun haf enuff... I go check then tell ü..,Non-Spam
854,Big brother‘s really scraped the barrel with this shower of social misfits,Non-Spam
855,Thats cool princess! I will cover your face in hot sticky cum :),Non-Spam
856,Huh so slow i tot u reach long ago liao... U 2 more days only i 4 more leh...,Non-Spam
857,Ya i knw u vl giv..its ok thanks kano..anyway enjoy wit ur family wit 1st salary..:-);-),Non-Spam
858,"Haha awesome, I might need to take you up on that, what you doin tonight?",Non-Spam
859,"Did you say bold, then torch later. Or one torch and 2bold?",Non-Spam
860,Wif my family booking tour package.,Non-Spam
861,Wow so healthy. Old airport rd lor. Cant thk of anything else. But i'll b bathing my dog later.,Non-Spam
862,Hey anyway i have to :-),Non-Spam
863,Yar but they say got some error.,Non-Spam
864,Mmmmmmm *snuggles into you* ...*deep contented sigh* ... *whispers* ... I fucking love you so much I can barely stand it ...,Non-Spam
865,Anytime...,Non-Spam
866,I liked the new mobile,Non-Spam
867,"WIN: We have a winner! Mr. T. Foley won an iPod! More exciting prizes soon, so keep an eye on ur mobile or visit www.win-82050.co.uk",Spam
868,Yes fine ,Non-Spam
869,Don no da:)whats you plan?,Non-Spam
870,"Okey dokey, i‘ll be over in a bit just sorting some stuff out.",Non-Spam
871,A guy who gets used but is too dumb to realize it.,Non-Spam
872,"URGENT! Your Mobile No 07808726822 was awarded a £2,000 Bonus Caller Prize on 02/09/03! This is our 2nd attempt to contact YOU! Call 0871-872-9758 BOX95QU",Spam
873,Pls give her the food preferably pap very slowly with loads of sugar. You can take up to an hour to give it. And then some water. Very very slowly.,Non-Spam
874,Tessy..pls do me a favor. Pls convey my birthday wishes to Nimya..pls dnt forget it. Today is her birthday Shijas,Non-Spam
875,"By march ending, i should be ready. But will call you for sure. The problem is that my capital never complete. How far with you. How's work and the ladies",Non-Spam
876,Surly ill give it to you:-) while coming to review.,Non-Spam
877,Ok no prob,Non-Spam
878,"Didn't try, g and I decided not to head out",Non-Spam
879,Hmmm.but you should give it on one day..,Non-Spam
880,Eatin my lunch...,Non-Spam
881,But pls dont play in others life.,Non-Spam
882,"Alright we'll bring it to you, see you in like  &lt;#&gt;  mins",Non-Spam
883,"My life Means a lot to me, Not because I love my life, But because I love the people in my life, The world calls them friends, I call them my World:-).. Ge:-)..",Non-Spam
884,Ok u can take me shopping when u get paid =D,Non-Spam
885,"Haha yeah, 2 oz is kind of a shitload",Non-Spam
886,Are you staying in town ?,Non-Spam
887,"That's cool he'll be here all night, lemme know when you're around",Non-Spam
888,Sry da..jst nw only i came to home..,Non-Spam
889,It is a good thing I'm now getting the connection to bw,Non-Spam
890,Wewa is 130. Iriver 255. All 128 mb.,Non-Spam
891,Ü ready then call me...,Non-Spam
892,"Hi babe its Chloe, how r u? I was smashed on saturday night, it was great! How was your weekend? U been missing me? SP visionsms.com Text stop to stop 150p/text",Spam
893,I'm leaving my house now.,Non-Spam
894,I forgot 2 ask ü all smth.. There's a card on da present lei... How? Ü all want 2 write smth or sign on it?,Non-Spam
895,"Customer service announcement. We recently tried to make a delivery to you but were unable to do so, please call 07099833605 to re-schedule. Ref:9280114",Spam
896,"Probably not, I'm almost out of gas and I get some cash tomorrow",Non-Spam
897,"I didnt get ur full msg..sometext is missing, send it again",Non-Spam
898,"When I was born, GOD said, ""Oh No! Another IDIOT"". When you were born, GOD said, ""OH No! COMPETITION"". Who knew, one day these two will become FREINDS FOREVER!",Non-Spam
899,IM REALY SOZ IMAT MY MUMS 2NITE WHAT ABOUT 2MORO ,Non-Spam
900,I send the print  outs da.,Non-Spam
901,Not..tel software name..,Non-Spam
902,Ok set let u noe e details later...,Non-Spam
903,Mum not going robinson already.,Non-Spam
904,No. Yes please. Been swimming?,Non-Spam
905,Ladies first and genus second k .,Non-Spam
906,Ok no prob...,Non-Spam
907,You call him and tell now infront of them. Call him now.,Non-Spam
908,I cant pick the phone right now. Pls send a message,Non-Spam
909,This message is from a great Doctor in India:-): 1) Do not drink APPY FIZZ. It contains Cancer causing age,Non-Spam
910,PRIVATE! Your 2003 Account Statement for shows 800 un-redeemed S. I. M. points. Call 08718738002 Identifier Code: 48922 Expires 21/11/04,Spam
911,"K, I'll work something out",Non-Spam
912,Our Prasanth ettans mother passed away last night. Just pray for her and family.,Non-Spam
913,Hope you are having a great day.,Non-Spam
914,Lol yes. But it will add some spice to your day.,Non-Spam
915,Where r e meeting tmr?,Non-Spam
916,A £400 XMAS REWARD IS WAITING FOR YOU! Our computer has randomly picked you from our loyal mobile customers to receive a £400 reward. Just call 09066380611 ,Spam
917,"Finally it has happened..! Aftr decades..! BEER is now cheaper than PETROL! The goverment expects us to ""DRINK"". . . But don't ""DRIVE """,Non-Spam
918,"Please protect yourself from e-threats. SIB never asks for sensitive information like Passwords,ATM/SMS PIN thru email. Never share your password with anybody.",Non-Spam
919,We are okay. Going to sleep now. Later,Non-Spam
920,God created gap btwn ur fingers so dat sum1 vry special will fill those gaps by holding ur hands.. Now plz dont ask y he created so much gap between legs !!!,Non-Spam
921,We tried to contact you re your reply to our offer of a Video Phone 750 anytime any network mins Half Price Line Rental Camcorder Reply or call 08000930705,Spam
922,Are you planning to come chennai?,Non-Spam
923,Did u got that persons story,Non-Spam
924,Sorry i din lock my keypad.,Non-Spam
925,You are being ripped off! Get your mobile content from www.clubmoby.com call 08717509990 poly/true/Pix/Ringtones/Games six downloads for only 3,Spam
926,Havent.,Non-Spam
927,Do you hide anythiing or keeping distance from me,Non-Spam
928,Of course. I guess god's just got me on hold right now.,Non-Spam
929,Captain vijaykanth is doing comedy in captain tv..he is drunken :),Non-Spam
930,Oh ho. Is this the first time u use these type of words,Non-Spam
931,K k pa Had your lunch aha.,Non-Spam
932,How come i din c ü... Yup i cut my hair...,Non-Spam
933,These won't do. Have to move on to morphine,Non-Spam
934,Oh wow thats gay. Will firmware update help,Non-Spam
935,"I'm in a meeting, call me later at",Non-Spam
936,"Got hella gas money, want to go on a grand nature adventure with galileo in a little bit?",Non-Spam
937,Everybody had fun this evening. Miss you.,Non-Spam
938,Only saturday and sunday holiday so its very difficult:),Non-Spam
939,Todays Voda numbers ending with 7634 are selected to receive a £350 reward. If you have a match please call 08712300220 quoting claim code 7684 standard rates apply.,Spam
940,Please call our customer service representative on 0800 169 6031 between 10am-9pm as you have WON a guaranteed £1000 cash or £5000 prize!,Spam
941,Lol ... I knew that .... I saw him in the dollar store,Non-Spam
942,I'm on the bus. Love you,Non-Spam
943,Jus finish blowing my hair. U finish dinner already?,Non-Spam
944,"U need my presnts always bcz U cant mis love. ""jeevithathile irulinae neekunna prakasamanu sneham"" prakasam ennal prabha 'That mns prabha is'LOVE' Got it. Dont mis me....",Non-Spam
945,They finally came to fix the ceiling.,Non-Spam
946,"Received, understood n acted upon!",Non-Spam
947,THIS IS A LONG FUCKIN SHOWR,Non-Spam
948,"Sorry, I'll call later In meeting.",Non-Spam
949,Nvm... I'm going to wear my sport shoes anyway... I'm going to be late leh.,Non-Spam
950,Good. do you think you could send me some pix? I would love to see your top and bottom...,Non-Spam
951,Ü called dad oredi...,Non-Spam
952,Sunshine Quiz! Win a super Sony DVD recorder if you canname the capital of Australia? Text MQUIZ to 82277. B,Spam
953,hows my favourite person today? r u workin hard? couldn't sleep again last nite nearly rang u at 4.30,Non-Spam
954,How much you got for cleaning,Non-Spam
955,Sorry da. I gone mad so many pending works what to do.,Non-Spam
956,Wat time ü finish?,Non-Spam
957,Just glad to be talking to you.,Non-Spam
